{
  "$schema": "https://json-schema.org/draft/2020-12/schema",
  "$id": "https://opennebula.io/schemas/sunstone-screenshot-manifest.schema.json",
  "title": "Sunstone screenshot automation manifest",
  "type": "object",
  "required": ["version", "screenshots"],
  "additionalProperties": false,
  "properties": {
    "group": {"type": "string", "description": "Group JSON path relative to this manifest."},
    "hooks": {
      "type": "object",
      "additionalProperties": false,
      "properties": {
        "setup": {"type": "array", "items": {"$ref": "#/$defs/guestCommand"}},
        "teardown": {"type": "array", "items": {"$ref": "#/$defs/guestCommand"}}
      }
    },
    "$schema": {
      "type": "string"
    },
    "version": {
      "type": "integer",
      "minimum": 1
    },
    "defaults": {
      "type": "object",
      "additionalProperties": true,
      "properties": {
        "viewport": {
          "$ref": "#/$defs/viewport"
        },
        "locale": {
          "type": "string"
        },
        "theme": {
          "enum": ["light", "dark"]
        },
        "sunstone": {
          "type": "object",
          "additionalProperties": true,
          "properties": {
            "url": {
              "type": "string"
            },
            "username": {
              "type": "string"
            },
            "password": {
              "type": "string"
            }
          }
        }
      }
    },
    "environments": {
      "type": "object",
      "additionalProperties": {
        "$ref": "#/$defs/environment"
      }
    },
    "screenshots": {
      "type": "array",
      "items": {
        "$ref": "#/$defs/screenshot"
      }
    },
    "deferredScreenshots": {
      "type": "array",
      "description": "Known screenshots that cannot yet be reproduced by this lab.",
      "items": {
        "type": "object",
        "additionalProperties": false,
        "required": ["image", "reason"],
        "properties": {
          "image": {"type": "string", "minLength": 1},
          "reason": {"type": "string", "minLength": 1}
        }
      }
    }
  },
  "$defs": {
    "guestCommand": {
      "type": "object",
      "oneOf": [{"required": ["command"], "not": {"required": ["script"]}}, {"required": ["script"], "not": {"required": ["command"]}}],
      "properties": {
        "command": {"type": "string", "minLength": 1},
        "script": {"type": "string", "minLength": 1},
        "timeout": {"type": "integer", "minimum": 1}
      }
    },
    "environment": {
      "type": "object",
      "required": ["kind"],
      "additionalProperties": true,
      "properties": {
        "kind": {
          "type": "string",
          "description": "Provisioning backend, for example opennebula-vm, existing-sunstone, or manual."
        },
        "template": {
          "type": "string"
        },
        "install": {
          "type": "object",
          "additionalProperties": true
        },
        "provisionCommand": {
          "type": "string",
          "description": "Optional local command that prepares the environment and prints Sunstone connection details."
        },
        "teardownCommand": {
          "type": "string"
        },
        "notes": {
          "type": "string"
        }
      }
    },
    "screenshot": {
      "type": "object",
      "required": ["id", "doc", "image", "recipe", "capture"],
      "additionalProperties": false,
      "properties": {
        "id": {
          "type": "string",
          "pattern": "^[a-z0-9][a-z0-9._-]*$"
        },
        "title": {
          "type": "string"
        },
        "doc": {
          "type": "string"
        },
        "docLine": {
          "type": "integer",
          "minimum": 1
        },
        "image": {
          "type": "string",
          "description": "Repository-relative path to the canonical light/current image."
        },
        "darkImage": {
          "type": "string",
          "description": "Repository-relative path to the dark-mode variant, when the docs page uses one."
        },
        "environment": {
          "type": "string"
        },
        "recipe": {
          "type": "string"
        },
        "capture": {
          "type": "string"
        },
        "sharedFrom": {
          "type": "object",
          "description": "Reuse a replacement captured by an earlier manifest in the same group; do not run its recipe again.",
          "additionalProperties": false,
          "required": ["manifest", "id"],
          "properties": {
            "manifest": {"type": "string", "minLength": 1},
            "id": {"type": "string", "minLength": 1}
          }
        },
        "viewport": {
          "$ref": "#/$defs/viewport"
        },
        "theme": {
          "enum": ["light", "dark", "both"]
        },
        "tags": {
          "type": "array",
          "items": {
            "type": "string"
          }
        },
        "owner": {
          "type": "string"
        },
        "status": {
          "enum": ["draft", "ready", "disabled"]
        },
        "notes": {
          "type": "string"
        }
      }
    },
    "viewport": {
      "type": "object",
      "required": ["width", "height"],
      "additionalProperties": false,
      "properties": {
        "width": {
          "type": "integer",
          "minimum": 320
        },
        "height": {
          "type": "integer",
          "minimum": 320
        },
        "deviceScaleFactor": {
          "type": "number",
          "minimum": 1
        }
      }
    }
  }
}
