{
  "$schema": "../../schemas/manifest.schema.json",
  "version": 1,
  "group": "group.json",
  "hooks": {
    "setup": [{"script": "scripts/prepare-alpine.sh", "timeout": 30}],
    "teardown": [{"script": "scripts/cleanup-alpine.sh", "timeout": 240}]
  },
  "screenshots": [
    {
      "id": "automated.alpine-running",
      "doc": "content/software/installation_process/frontend_installation/automated.md",
      "image": "assets/images/quickstart/light/sunstone_vm_instances.png",
      "recipe": "recipes/login.json",
      "capture": "alpine-running",
      "status": "draft"
    }
  ]
}
